{
  "id":"semi-design","name":"Semi Design","organization":"ByteDance","sourceType":"public-guideline","sourceStatus":"基于公开设计规范","sourceUrl":"https://semi.design/","reviewedAt":"2026-08-13","platforms":["web","react"],"description":"抖音前端团队开源的企业级 React 设计系统，覆盖国际化、无障碍和复杂业务组件。","componentReferenceIds":["semi-button","semi-table","semi-modal"],"disclaimer":"本资料基于 Semi Design 公开文档整理，与字节跳动或 Semi Design 无隶属或背书关系；名称与标识归其各自权利人所有。","locales":{"en":{"sourceStatus":"Based on public design guidelines","description":"An open-source enterprise React design system from the Douyin frontend team, covering internationalization, accessibility, and complex business components.","disclaimer":"Compiled from public Semi Design documentation with no affiliation or endorsement. Names and marks belong to their respective owners."}}
}
